id,title,summary,date,url,author_raw,contributors,n_contributors,keywords,body_text,section_id,section_name
politics/2005/may/10/foreignpolicy.usa,An ethical blank cheque,<p><strong>Richard Drayton:</strong> British and US mythology about the second world war ignores our own crimes and legitimises Anglo-American warmaking.</p>,2005-05-09 23:37:00+00:00,https://www.theguardian.com/politics/2005/may/10/foreignpolicy.usa,Richard Drayton,"[""Richard Drayton""]",1,"[""Politics"", ""Foreign policy"", ""US news"", ""Second world war"", ""World news""]","In 1945, as at the end of all wars, the victor powers spun the conflict's history to serve the interests of their elites. Wartime propaganda thus achieved an extraordinary afterlife. As Vladimir Putin showed yesterday, the Great Patriotic War remains a key political resource in Russia. In Britain and the US, too, a certain idea of the second world war is enthusiastically kept alive and less flattering memories suppressed. Five years ago, Robert Lilly, a distinguished American sociologist, prepared a book based on military archives. Taken by Force is a study of the rapes committed by American soldiers in Europe between 1942 and 1945. He submitted his manuscript in 2001. But after September 11, its US publisher suppressed it, and it first appeared in 2003 in a French translation. We know from Anthony Beevor about the sexual violence unleashed by the Red Army, but we prefer not to know about mass rape committed by American and British troops. Lilly suggests a minimum of 10,000 American rapes. Contemporaries described a much wider scale of unpunished sex crime. Time Magazine reported in September 1945: ""Our own army and the British army along with ours have done their share of looting and raping ... we too are considered an army of rapists."" The British and American publics share a sunny view of the second world war. The evil of Auschwitz and Dachau, turned inside out, clothes the conflict in a shiny virtue. Movies, popular histories and political speeches frame the war as a symbol of Anglo-American courage, with the Red Army's central role forgotten. This was, we believe, ""a war for democracy"". Americans believe that they fought the war to rescue the world. For apologists of the British Empire, such as Niall Ferguson, the war was an ethical bath where the sins of centuries of conquest, slavery and exploitation were expiated. We are marked forever as ""the good guys""and can all happily chant ""Two world wars and one world cup."" All this seems innocent fun, but patriotic myths have sharp edges. The ""good war"" against Hitler has underwritten 60 years of warmaking. It has become an ethical blank cheque for British and US power. We claim the right to bomb, to maim, to imprison without trial on the basis of direct and implicit appeals to the war against fascism. When we fall out with such tyrant friends as Noriega, Milosevic or Saddam we rebrand them as ""Hitler"". In the ""good war"" against them, all bad things become forgettable ""collateral damage"". The devastation of civilian targets in Serbia or Iraq, torture at Abu Ghraib and Guantánamo, the war crime of collective punishment in Falluja, fade to oblivion as the ""price of democracy"". Our democratic imperialism prefers to forget that fascism had important Anglo-American roots. Hitler's dream was inspired, in part, by the British Empire. In eastern Europe, the Nazis hoped to make their America and Australia, where ethnic cleansing and slave labour created a frontier for settlement. In western Europe, they sought their India from which revenues, labour and soldiers might be extracted. American imperialism in Latin America gave explicit precedents for Germany's and Japan's claims of supremacy in their neighbouring regions. The British and Americans were key theorists of eugenics and had made racial segregation respectable. The concentration camp was a British invention, and in Iraq and Afghanistan the British were the first to use air power to repress partisan resistance. The Luftwaffe - in its assault on Guernica, and later London and Coventry - paid homage to Bomber Harris's terror bombing of the Kurds in the 1920s. We forget, too, that British and US elites gave aid to the fascists. President Bush's grandfather, prosecuted for ""trading with the enemy"" in 1942, was one of many powerful Anglo-Americans who liked Mussolini and Hitler and did what they could to help. Appeasement as a state policy was only the tip of an iceberg of practical aid to these dictatorships. Capital and technology flowed freely, and fascist despots received dignified treatment in Washington and London. Henry Ford made Hitler birthday gifts of 50,000 marks. We least like to remember that our side also committed war crimes in the 1940s. The destruction of Dresden, a city filled with women, children, the elderly and the wounded, and with no military significance, is only the best known of the atrocities committed by our bombers against civilian populations. We know about the notorious Japanese abuse of prisoners of war, but do not remember the torture and murder of captured Japanese. Edgar Jones, an ""embedded"" Pacific war correspondent, wrote in 1946: ""'We shot prisoners in cold blood, wiped out hospitals, strafed lifeboats, killed or mistreated enemy civilians, finished off the enemy wounded, tossed the dying into a hole with the dead, and in the Pacific boiled flesh off enemy skulls to make table ornaments."" After 1945, we borrowed many fascist methods. Nuremberg only punished a handful of the guilty; most walked free with our help. In 1946, Project Paperclip secretly brought more than 1,000 Nazi scientists to the US. Among their ranks were Kurt Blome, who had tested nerve gas at Auschwitz, and Konrad Schaeffer, who forced salt into victims at Dachau. Other experiments at mind control via drugs and surgery were folded into the CIA's Project Bluebird. Japan's Dr Shiro Ishii, who had experimented with prisoners in Manchuria, came to Maryland to advise on bio-weapons. Within a decade of British troops liberating Belsen, they were running their own concentration camps in Kenya to crush the Mau Mau. The Gestapo's torture techniques were borrowed by the French in Algeria, and then disseminated by the Americans to Latin American dictatorships in the 60s and 70s. We see their extension today in the American camps in Cuba and Diego Garcia. War has a brutalising momentum. This is the moral of Taken By Force, which shows how American soldiers became increasingly indiscriminate in their sexual violence and military authorities increasingly lax in its prosecution. Even as we remember the evils of nazism, and the courage of those who defeated it, we should begin to remember the second world war with less self- satisfaction. We might, in particular, learn to distrust those who use it to justify contemporary warmongering. · Richard Drayton is senior lecturer in history at Cambridge University.",commentisfree,Opinion
politics/2005/aug/20/past.hearafrica05,The wealth of the west was built on Africa's exploitation,<p><strong>Richard Drayton:</strong> Britain has never faced up to the dark side of its imperial history.</p>,2005-08-20 00:31:00+00:00,https://www.theguardian.com/politics/2005/aug/20/past.hearafrica05,Richard Drayton,"[""Richard Drayton""]",1,"[""Politics"", ""Politics past"", ""Guardian Hear Africa campaign 2005"", ""Global development""]","Britain was the principal slaving nation of the modern world. In The Empire Pays Back, a documentary broadcast by Channel 4 on Monday, Robert Beckford called on the British to take stock of this past. Why, he asked, had Britain made no apology for African slavery, as it had done for the Irish potato famine? Why was there no substantial public monument of national contrition equivalent to Berlin's Holocaust Museum? Why, most crucially, was there no recognition of how wealth extracted from Africa and Africans made possible the vigour and prosperity of modern Britain? Was there not a case for Britain to pay reparations to the descendants of African slaves? These are timely questions in a summer in which Blair and Bush, their hands still wet with Iraqi blood, sought to rebrand themselves as the saviours of Africa. The G8's debt-forgiveness initiative was spun successfully as an act of western altruism. The generous Massas never bothered to explain that, in order to benefit, governments must agree to ""conditions"", which included allowing profit-making companies to take over public services. This was no gift; it was what the merchant bankers would call a ""debt-for-equity swap"", the equity here being national sovereignty. The sweetest bit of the deal was that the money owed, already more than repaid in interest, had mostly gone to buy industrial imports from the west and Japan, and oil from nations who bank their profits in London and New York. Only in a bookkeeping sense had it ever left the rich world. No one considered that Africa's debt was trivial compared to what the west really owes Africa. Beckford's experts estimated Britain's debt to Africans in the continent and diaspora to be in the trillions of pounds. While this was a useful benchmark, its basis was mistaken. Not because it was excessive, but because the real debt is incalculable. For without Africa and its Caribbean plantation extensions, the modern world as we know it would not exist. Profits from slave trading and from sugar, coffee, cotton and tobacco are only a small part of the story. What mattered was how the pull and push from these industries transformed western Europe's economies. English banking, insurance, shipbuilding, wool and cotton manufacture, copper and iron smelting, and the cities of Bristol, Liverpool and Glasgow, multiplied in response to the direct and indirect stimulus of the slave plantations. Joseph Inikori's masterful book, Africans and the Industrial Revolution in England, shows how African consumers, free and enslaved, nurtured Britain's infant manufacturing industry. As Malachy Postlethwayt, the political economist, candidly put it in 1745: ""British trade is a magnificent superstructure of American commerce and naval power on an African foundation."" In The Great Divergence, Kenneth Pomeranz asked why Europe, rather than China, made the breakthrough first into a modern industrial economy. To his two answers - abundant coal and New World colonies - he should have added access to west Africa. For the colonial Americas were more Africa's creation than Europe's: before 1800, far more Africans than Europeans crossed the Atlantic. New World slaves were vital too, strangely enough, for European trade in the east. For merchants needed precious metals to buy Asian luxuries, returning home with profits in the form of textiles; only through exchanging these cloths in Africa for slaves to be sold in the New World could Europe obtain new gold and silver to keep the system moving. East Indian companies led ultimately to Europe's domination of Asia and its 19th-century humiliation of China. Africa not only underpinned Europe's earlier development. Its palm oil, petroleum, copper, chromium, platinum and in particular gold were and are crucial to the later world economy. Only South America, at the zenith of its silver mines, outranks Africa's contribution to the growth of the global bullion supply. The guinea coin paid homage in its name to the west African origins of one flood of gold. By this standard, the British pound since 1880 should have been rechristened the rand, for Britain's prosperity and its currency stability depended on South Africa's mines. I would wager that a large share of that gold in the IMF's vaults which was supposed to pay for Africa's debt relief had originally been stolen from that continent. There are many who like to blame Africa's weak governments and economies, famines and disease on its post-1960 leadership. But the fragility of contemporary Africa is a direct consequence of two centuries of slaving, followed by another of colonial despotism. Nor was ""decolonisation"" all it seemed: both Britain and France attempted to corrupt the whole project of political sovereignty. It is remarkable that none of those in Britain who talk about African dictatorship and kleptocracy seem aware that Idi Amin came to power in Uganda through British covert action, and that Nigeria's generals were supported and manipulated from 1960 onwards in support of Britain's oil interests. It is amusing, too, to find the Telegraph and the Daily Mail - which just a generation ago supported Ian Smith's Rhodesia and South African apartheid - now so concerned about human rights in Zimbabwe. The tragedy of Mugabe and others is that they learned too well from the British how to govern without real popular consent, and how to make the law serve ruthless private interest. The real appetite of the west for democracy in Africa is less than it seems. We talk about the Congo tragedy without mentioning that it was a British statesman, Alec Douglas-Home, who agreed with the US president in 1960 that Patrice Lumumba, its elected leader, needed to ""fall into a river of crocodiles"". African slavery and colonialism are not ancient or foreign history; the world they made is around us in Britain. It is not merely in economic terms that Africa underpins a modern experience of (white) British privilege. Had Africa's signature not been visible on the body of the Brazilian Jean Charles de Menezes, would he have been gunned down on a tube at Stockwell? The slight kink of the hair, his pale beige skin, broadcast something misread by police as foreign danger. In that sense, his shooting was the twin of the axe murder of Anthony Walker in Liverpool, and of the more than 100 deaths of black people in mysterious circumstances while in police, prison or hospital custody since 1969. This universe of risk, part of the black experience, is the afterlife of slavery. The reverse of the medal is what WEB DuBois called the ""wage of whiteness"", the world of safety, trustworthiness, welcome that those with pale skins take for granted. The psychology of racism operates even among those who believe in human equality, shaping unequal outcomes in education, employment, criminal justice. By its light, such all-white clubs as the G8 continue to meet in comfort. Early this year, Gordon Brown told journalists in Mozambique that Britain should stop apologising for colonialism. The truth is, though, that Britain has never even faced up to the dark side of its imperial history, let alone begun to apologise. Dr Richard Drayton is a senior lecturer in imperial and extra-European history since 1500 at Cambridge University. His book The Caribbean and the Making of the Modern World will be published in 2006. RHDrayton@yahoo.co.uk",commentisfree,Opinion
world/2005/dec/28/usa.iraq,"Shock, awe and Hobbes have backfired on America's neocons",<p><strong>Richard Drayton: </strong>Iraq has shown the hubris of a geostrategy that welds the philosophy of the Leviathan to military and technological power.</p>,2005-12-28 00:03:00+00:00,https://www.theguardian.com/world/2005/dec/28/usa.iraq,Richard Drayton,"[""Richard Drayton""]",1,"[""US news"", ""Iraq"", ""World news"", ""Middle East and north Africa""]","The tragic irony of the 21st century is that just as faith in technology collapsed on the world's stock markets in 2000, it came to power in the White House and Pentagon. For the Project for a New American Century's ambition of ""full-spectrum dominance"" - in which its country could ""fight and win multiple, simultaneous major-theatre wars"" - was a monster borne up by the high tide of techno euphoria of the 1990s. Ex-hippies talked of a wired age of Aquarius. The fall of the Berlin wall and the rise of the internet, we were told, had ushered in Adam Smith's dream of overflowing abundance, expanding liberty and perpetual peace. Fukuyama speculated that history was over, leaving us just to hoard and spend. Technology meant a new paradigm of constant growth without inflation or recession. But darker dreams surfaced in America's military universities. The theorists of the ""revolution in military affairs"" predicted that technology would lead to easy and perpetual US dominance of the world. Lieutenant Colonel Ralph Peters advised on ""future warfare"" at the Army War College - prophesying in 1997 a coming ""age of constant conflict"". Thomas Barnett at the Naval War College assisted Vice-Admiral Cebrowski in developing ""network-centric warfare"". General John Jumper of the air force predicted a planet easily mastered from air and space. American forces would win everywhere because they enjoyed what was unashamedly called the ""God's-eye"" view of satellites and GPS: the ""global information grid"". This hegemony would be welcomed as the cutting edge of human progress. Or at worst, the military geeks candidly explained, US power would simply terrify others into submitting to the stars and stripes. Shock and Awe: Achieving Rapid Dominance - a key strategic document published in 1996 - aimed to understand how to destroy the ""will to resist before, during and after battle"". For Harlan Ullman of the National Defence University, its main author, the perfect example was the atom bomb at Hiroshima. But with or without such a weapon, one could create an illusion of unending strength and ruthlessness. Or one could deprive an enemy of the ability to communicate, observe and interact - a macro version of the sensory deprivation used on individuals - so as to create a ""feeling of impotence"". And one must always inflict brutal reprisals against those who resist. An alternative was the ""decay and default"" model, whereby a nation's will to resist collapsed through the ""imposition of social breakdown"". All of this came to be applied in Iraq in 2003, and not merely in the March bombardment called ""shock and awe"". It has been usual to explain the chaos and looting in Baghdad, the destruction of infrastructure, ministries, museums and the national library and archives, as caused by a failure of Rumsfeld's planning. But the evidence is this was at least in part a mask for the destruction of the collective memory and modern state of a key Arab nation, and the manufacture of disorder to create a hunger for the occupier's supervision. As the Süddeutsche Zeitung reported in May 2003, US troops broke the locks of museums, ministries and universities and told looters: ""Go in Ali Baba, it's all yours!"" For the American imperial strategists invested deeply in the belief that through spreading terror they could take power. Neoconservatives such as Paul Wolfowitz, Richard Perle and the recently indicted Lewis ""Scooter"" Libby, learned from Leo Strauss that a strong and wise minority of humans had to rule over the weak majority through deception and fear, rather than persuasion or compromise. They read Le Bon and Freud on the relationship of crowds to authority. But most of all they loved Hobbes's Leviathan. While Hobbes saw authority as free men's chosen solution to the imperfections of anarchy, his 21st century heirs seek to create the fear that led to submission. And technology would make it possible and beautiful. On the logo of the Pentagon's Information Awareness Office, the motto is Scientia est potentia - knowledge is power . The IAO promised ""total information awareness"", an all-seeing eye spilling out a death-ray gaze over Eurasia. Congressional pressure led the IAO to close, but technospeak, half-digested political theory and megalomania still riddle US thinking. Barnett, in The Pentagon's New Map and Blueprint for Action, calls for a ""systems administrator"" force to be dispatched with the military, to ""process"" conquered countries. The G8 and a few others are the ""Kantian core"", writes Barnett, warming over the former Blair adviser Robert Cooper's poisonous guff from 2002; their job is to export their economy and politics by force to the unlucky ""Hobbesian gap"". Imperialism is imagined as an industrial technique to remake societies and cultures, with technology giving sanction to those who intervene. The Afghanistan war of 2001 taught the wrong lessons. The US assumed this was the model of how a small, special forces-dominated campaign, using local proxies and calling in gunships or airstrikes, would sweep away opposition. But all Afghanistan showed was how an outside power could intervene in a finely balanced civil war. The one-eyed Mullah Omar's great escape on his motorbike was a warning that the God's-eye view can miss the human detail. The problem for the US today is that Leviathan has shot his wad. Iraq revealed the hubris of the imperial geostrategy. One small nation can tie down a superpower. Air and space supremacy do not give command on the ground. People can't be terrorised into identification with America. The US has proved able to destroy massively - but not create, or even control. Afghanistan and Iraq lie in ruins, yet the occupiers cower behind concrete mountains. The spin machine is on full tilt to represent Iraq as a success. Peters, in New Glory: Expanding America's Supremacy, asserts: ""Our country is a force for good without precedent""; and Barnett, in Blueprint, says: ""The US military is a force for global good that ... has no equal."" Both offer ambitious plans for how the US is going to remake the third world in its image. There is a violent hysteria to the boasts. The narcissism of a decade earlier has given way to an extrovert rage at those who have resisted America's will since 2001. Both urge utter ruthlessness in crushing resistance. In November 2004, Peters told Fox News that in Falluja ""the best outcome, frankly, is if they're all killed"". But he directs his real fury at France and Germany: ""A haggard Circe, Europe dulled our senses and fooled us into believing in her attractions. But the dugs are dry in Germany and France. They deluded us into prolonging the affair long after our attentions should have turned to ... India, South Africa, Brazil."" While a good Kleinian therapist may be able to help Peters work through his weaning trauma, only America can cure its post 9/11 mixture of paranoia and megalomania. But Britain - and other allied states - can help. The US needs to discover, like a child that does not know its limits, that there is a world outside its body and desires, beyond even the reach of its toys, that suffers too. · Dr Richard Drayton, a senior lecturer in history at Cambridge University, is the author of Nature's Government, a study of science, technology and imperialism RHDrayton@yahoo.co.uk",commentisfree,Opinion
